<?xml version="1.0" encoding="UTF-8"?>
<!DOCTYPE item PUBLIC "-//UPS//DTD MELCDL-REV1//EN" "melcdl.dtd">
<item chapnbr="21" chg="U" itemnbr="1-1" key="UPS747MEL20070815101733" revdate="20080827" revnbr="5" sectnbr="58">
<title>Equipment Cooling Control System &ndash; NORM Mode </title>
<dispcond category="C" maintenance="NO" nbrins="1" nbrreq="0"
operation="YES" btb="NO">
<remarks>
<para>May be inoperative provided:</para>
<numlist>
<numlitem><para>STBY mode is used, and</para></numlitem>
<numlitem><para>For ground operation above 105&deg;F OAT (41&deg;C)
at least one pack is operative.</para></numlitem>
</numlist>
</remarks>
<operation key="UPS747MEL20070815101734">
<numlist>
<numlitem><para>Select STBY mode.</para></numlitem>
<numlitem><para>Ensure at least one pack is operating for ground operation
above 105&deg;F OAT (41&deg;C).</para></numlitem>
</numlist>
</operation>
<placard>
<para>Placard adjacent to the Equipment Cooling selector "NORM INOP".
 Enter item in Aircraft Deferred Item Log.</para>
</placard>
</dispcond>
</item>
