<?xml version="1.0" encoding="UTF-8"?>
<!DOCTYPE item PUBLIC "-//UPS//DTD MELCDL-REV1//EN" "melcdl.dtd">
<item chapnbr="29" chg="U" itemnbr="2-2" key="UPS747MEL20070815103710" revdate="20100707" revnbr="8" sectnbr="11">
<!--Per email that Tim sent 1/14/10 Rev 8-->
<title>Demand Hydraulic Pumps &ndash; No. 2 or No. 3 Demand Pump Systems</title>
<dispcond attr-rev="NO" category="C" maintenance="YES" nbrins="2"
nbrreq="1" operation="NO" btb="YES">
<remarks>
<para>One may be inoperative deactivated provided demand pumps 1 and
4 are operative.</para>
</remarks>
<operation key="UPS747MEL20070815103711">
<note><para>The following EICAS message(s) may be displayed:</para>
<para>HYD PRESS DEM ___</para>
</note>
</operation>
<placard>
<para>Placard adjacent to associated #2 or #3 Demand pump switch:
"INOP". Enter item in Aircraft Deferred Item Log.</para>
</placard>
<maintenance key="UPS747MEL20070815103712">
<numlist>
<numlitem><para>Accomplish Dispatch Maintenance Procedure <refint
refid="UPS747MEL20070815103659" reftype="MNT">29-11-2-1</refint>.</para>
</numlitem>
</numlist>
</maintenance>
</dispcond>
</item>
