<?xml version="1.0" encoding="UTF-8"?>
<!DOCTYPE item PUBLIC "-//UPS//DTD MELCDL-REV1//EN" "melcdl.dtd">
<item chapnbr="21" chg="U" itemnbr="13" key="UPS747MEL20070815101923" revdate="20080827" revnbr="5" sectnbr="61">
<title>Flight Deck Flow Regulating Valve </title>
<dispcond category="C" maintenance="YES" nbrins="1" nbrreq="0"
operation="NO" btb="YES">
<remarks>
<para>May be inoperative secured open.</para>
</remarks>
<operation key="UPS747MEL20070815101924">
<note><para>The following EICAS message(s) may be displayed:</para>
<para>ZONE TEMP</para>
</note>
<numlist>
<numlitem><para>To maintain normal flow rate and noise level during
all flight phases.  Position LOWER LOBE CARGO COND AIR FLOW RATE selector
to either FWD HIGH, AFT HIGH, or BOTH LOW.</para></numlitem>
</numlist>
</operation>
<placard>
<para>Placard adjacent to the TRIM AIR switch "FLIGHT DECK FLOW REGULATING
VLV INOP".  Enter item in Aircraft Deferred Item Log.</para>
</placard>
<maintenance key="UPS747MEL20070815101925">
<numlist>
<numlitem><para>To secure Flight Deck Flow Regulating Valve in the
open position do the following:</para>
<numlist>
<numlitem><para>Open the P6 panel ZONE TEMP CONT AC and ZONE TEMP
CONT DC circuit breakers.</para></numlitem>
<numlitem><para>Locate the Flight Deck Flow Regulating valve under
the main deck floor at STA 1130, WL 194, LBL 45.</para>
<numlist>
<numlitem><para>Disconnect, cap, and stow the valve&rsquo;s electrical
connector. </para></numlitem>
<numlitem><para>Manually position the valve in the OPEN position (requires
an Allen wrench).</para></numlitem>
</numlist>
</numlitem>
<numlitem><para>Close the P6 panel ZONE TEMP CONT AC and ZONE TEMP
CONT DC circuit breakers.</para></numlitem>
</numlist>
</numlitem>
<numlitem><para>With the flight deck flow regulating valve secured
open, status message ZONE TEMP will remain displayed.</para></numlitem>
<numlitem><para>Status message ZONE TEMP may remain displayed if the
flight deck flow regulating valve is secured open.</para></numlitem>
</numlist>
</maintenance>
</dispcond>
</item>
