<?xml version="1.0" encoding="UTF-8"?>
<!DOCTYPE cdlblk PUBLIC "-//UPS//DTD MELCDL-REV1//EN" "melcdl.dtd">
<cdlblk blknbr="1" chapnbr="71" chg="U" key="UPS-757-MEL-00001556" qtyreq="16" revdate="20080924" revnbr="65" sectnbr="00">
<title>(RR) POWER PLANT TRAILING EDGE SEAL</title>
<remarks>
<para>One per engine may be missing provided the performance and weights
are reduced by:</para>
<table frame="none">
<tgroup cols="3">
<colspec align="left" colname="col1" colwidth="1.01*"/>
<colspec align="right" colname="col2" colwidth="0.62*"/>
<colspec align="left" colname="COLSPEC0" colwidth="1.74*"/>
<tbody>
<row>
<entry colsep="0" rowsep="0">
<para>Takeoff and Landing:</para>
</entry>
<entry colsep="0" rowsep="0">
<para>&ndash;</para>
</entry>
<entry colsep="0" rowsep="0">
<para>193 lbs/seal</para>
</entry>
</row>
<row>
<entry colsep="0" rowsep="0">
<para>En route Climb:</para>
</entry>
<entry colsep="0" rowsep="0">
<para>&ndash;</para>
</entry>
<entry colsep="0" rowsep="0">
<para>287 lbs/seal</para>
</entry>
</row>
<row>
<entry align="center" colsep="0" nameend="COLSPEC0" namest="col1"
rowsep="0">
<para>(Fuel burn increase 0.20%)</para>
</entry>
</row>
</tbody>
</tgroup>
</table>
</remarks>
</cdlblk>
