<?xml version="1.0" encoding="UTF-8"?>
<!DOCTYPE item PUBLIC "-//UPS//DTD MELCDL-REV1//EN" "melcdl.dtd">
<item chapnbr="21" chg="U" itemnbr="1-1" key="UPS757MELCDL20080527114925" revdate="20080924" revnbr="65" sectnbr="23">
<title>Return Air Grille &ndash; All Cargo Configuration</title>
<dispcond category="C" maintenance="YES" nbrins="16" nbrreq="15">
<remarks>
<para>One may be broken or missing provided:</para>
<numlist>
<numlitem><para>Broken or missing grille is located within a designated
area, and</para></numlitem>
<numlitem><para>Alternate procedures are established and used to cover
grille.</para></numlitem>
</numlist>
</remarks>
<placard>
<para>Placard next to upper EICAS screen "RETURN AIR GRILLE AT STA
____ BLOCKED" and enter item in Aircraft Deferred Item Log.</para>
</placard>
<maintenance key="UPS757MELCDL20080527115540">
<note><para>One Return Air Grille may be blocked off only in the following
area. (No other Return Air Grille may be blocked off):</para><para
>-STA 1260 to 1360 both left and right sides.</para>
<para>-STA 1600 to 1720 right side only.</para>
<para>-STA 1620 to 1720 left side only.</para>
<numlist>
<numlitem><para>Damages such as dents, cracks (minor nature) and cosmetic
conditions that do not allow any object larger than the nominal screen
vent hole size to pass thru into the air return box area are acceptable
for normal operation.</para></numlitem>
<numlitem><para>Severe damages that can allow objects larger than
the nominal screen vent holes to pass thru into the air return box
area, cause damage to personnel or equipment, or prevent the Return
Air Grille from performing as intended, must be corrected.</para>
</numlitem>
<numlitem><para>One severely damaged or missing Return Air Grille
located in the designated area may be blocked off with speed tape
or a panel that completely covers the grille area using standard SRM
procedures.</para></numlitem>
</numlist>
</note>
</maintenance>
</dispcond>
</item>
