<?xml version="1.0" encoding="UTF-8"?>
<!DOCTYPE item PUBLIC "-//UPS//DTD MELCDL-REV1//EN" "melcdl.dtd">
<item chapnbr="26" chg="U" itemnbr="2-1" key="UPS747MEL20070815102816" revdate="20080827" revnbr="5" sectnbr="11">
<title>Engine Overheat Detection System &ndash; Detection Loop</title>
<dispcond category="C" nbrins="8" nbrreq="4" operation="NO">
<remarks>
<para>One loop per engine may be inoperative.</para>
</remarks>
<operation key="UPS747MEL20070815102817">
<note><para>The following EICAS message(s) may be displayed:</para>
<para>ENG ___ OVHT LP ___</para>
</note>
</operation>
<placard>
<para>Placard below Captain&rsquo;s PFD on P-1-1 panel: "___ ENGINE___
FIRE LOOP INOP". Enter Item in Aircraft Deferred Item Log.</para>
</placard>
</dispcond>
</item>
